{
  "name": "claude-skills",
  "owner": {
    "name": "Claude Skills Maintainers",
    "email": "maintainers@example.com",
    "url": "https://github.com/secondsky/claude-skills"
  },
  "metadata": {
    "description": "Production-tested skills for Claude Code - Cloudflare, AI, React, Tailwind v4, and modern web development",
    "version": "3.10.0",
    "homepage": "https://github.com/secondsky/claude-skills"
  },
  "plugins": [
    {
      "name": "aceternity-ui",
      "source": "./plugins/aceternity-ui",
      "version": "3.10.0",
      "description": "100+ animated React components (Aceternity UI) for Next.js with Tailwind. Use for hero sections, parallax, 3D effects, or encountering animation, shadcn CLI integration errors.",
      "keywords": [
        "aceternity-ui",
        "aceternity",
        "frontend",
        "components",
        "cli"
      ],
      "category": "frontend"
    },
    {
      "name": "api-authentication",
      "source": "./plugins/api-authentication",
      "version": "3.10.0",
      "description": "Secure API authentication with JWT, OAuth 2.0, API keys. Use for authentication systems, third-party integrations, service-to-service communication, or encountering token management, security headers, auth flow errors.",
      "keywords": [
        "api-authentication",
        "api",
        "authentication",
        "authorization",
        "login",
        "security",
        "session",
        "jwt"
      ],
      "category": "auth"
    },
    {
      "name": "api-changelog-versioning",
      "source": "./plugins/api-changelog-versioning",
      "version": "3.10.0",
      "description": "Creates comprehensive API changelogs documenting breaking changes, deprecations, and migration strategies for API consumers. Use when managing API versions, communicating breaking changes, or creating upgrade guides.",
      "keywords": [
        "api-changelog-versioning",
        "api",
        "changelog",
        "versioning",
        "rest",
        "graphql",
        "endpoints",
        "http",
        "migration"
      ],
      "category": "api"
    },
    {
      "name": "api-contract-testing",
      "source": "./plugins/api-contract-testing",
      "version": "3.10.0",
      "description": "Verifies API contracts between services using consumer-driven contracts, schema validation, and tools like Pact. Use when testing microservices communication, preventing breaking changes, or validating OpenAPI specifications.",
      "keywords": [
        "api-contract-testing",
        "api",
        "contract",
        "testing",
        "rest",
        "graphql",
        "endpoints",
        "http",
        "openapi",
        "validation"
      ],
      "category": "api"
    },
    {
      "name": "api-design-principles",
      "source": "./plugins/api-design-principles",
      "version": "3.10.0",
      "description": "Master REST and GraphQL API design principles to build intuitive, scalable, and maintainable APIs that delight developers. Use when designing new APIs, reviewing API specifications, or establishing API design standards.",
      "keywords": [
        "api-design-principles",
        "api",
        "design",
        "principles",
        "rest",
        "graphql",
        "endpoints",
        "http",
        "scalable",
        "maintainable"
      ],
      "category": "api"
    },
    {
      "name": "api-error-handling",
      "source": "./plugins/api-error-handling",
      "version": "3.10.0",
      "description": "Implements standardized API error responses with proper status codes, logging, and user-friendly messages. Use when building production APIs, implementing error recovery patterns, or integrating error monitoring services.",
      "keywords": [
        "api-error-handling",
        "api",
        "error",
        "handling",
        "rest",
        "graphql",
        "endpoints",
        "http"
      ],
      "category": "api"
    },
    {
      "name": "api-filtering-sorting",
      "source": "./plugins/api-filtering-sorting",
      "version": "3.10.0",
      "description": "Builds flexible API filtering and sorting systems with query parameter parsing, validation, and security. Use when implementing search endpoints, building data grids, or creating dynamic query APIs.",
      "keywords": [
        "api-filtering-sorting",
        "api",
        "filtering",
        "sorting",
        "rest",
        "graphql",
        "endpoints",
        "http",
        "validation"
      ],
      "category": "api"
    },
    {
      "name": "api-gateway-configuration",
      "source": "./plugins/api-gateway-configuration",
      "version": "3.10.0",
      "description": "Configures API gateways for routing, authentication, rate limiting, and request transformation in microservice architectures. Use when setting up Kong, Nginx, AWS API Gateway, or Traefik for centralized API management.",
      "keywords": [
        "api-gateway-configuration",
        "api",
        "gateway",
        "configuration",
        "rest",
        "graphql",
        "endpoints",
        "http",
        "aws",
        "authentication"
      ],
      "category": "api"
    },
    {
      "name": "api-pagination",
      "source": "./plugins/api-pagination",
      "version": "3.10.0",
      "description": "Implements efficient API pagination using offset, cursor, and keyset strategies for large datasets. Use when building paginated endpoints, implementing infinite scroll, or optimizing database queries for collections.",
      "keywords": [
        "api-pagination",
        "api",
        "pagination",
        "rest",
        "graphql",
        "endpoints",
        "http"
      ],
      "category": "api"
    },
    {
      "name": "api-rate-limiting",
      "source": "./plugins/api-rate-limiting",
      "version": "3.10.0",
      "description": "Implements API rate limiting using token bucket, sliding window, and Redis-based algorithms to protect against abuse. Use when securing public APIs, implementing tiered access, or preventing denial-of-service attacks.",
      "keywords": [
        "api-rate-limiting",
        "api",
        "rate",
        "limiting",
        "rest",
        "graphql",
        "endpoints",
        "http"
      ],
      "category": "api"
    },
    {
      "name": "api-reference-documentation",
      "source": "./plugins/api-reference-documentation",
      "version": "3.10.0",
      "description": "Creates professional API documentation using OpenAPI specifications with endpoints, authentication, and interactive examples. Use when documenting REST APIs, creating SDK references, or building developer portals.",
      "keywords": [
        "api-reference-documentation",
        "api",
        "reference",
        "documentation",
        "rest",
        "graphql",
        "endpoints",
        "http",
        "openapi",
        "authentication"
      ],
      "category": "api"
    },
    {
      "name": "api-response-optimization",
      "source": "./plugins/api-response-optimization",
      "version": "3.10.0",
      "description": "Optimizes API performance through payload reduction, caching strategies, and compression techniques. Use when improving API response times, reducing bandwidth usage, or implementing efficient caching.",
      "keywords": [
        "api-response-optimization",
        "api",
        "response",
        "optimization",
        "rest",
        "graphql",
        "endpoints",
        "http",
        "caching"
      ],
      "category": "api"
    },
    {
      "name": "api-security-hardening",
      "source": "./plugins/api-security-hardening",
      "version": "3.10.0",
      "description": "REST API security hardening with authentication, rate limiting, input validation, security headers. Use for production APIs, security audits, defense-in-depth, or encountering vulnerabilities, injection attacks, CORS issues.",
      "keywords": [
        "api-security-hardening",
        "api",
        "security",
        "hardening",
        "rest",
        "graphql",
        "endpoints",
        "http",
        "cors",
        "authentication",
        "validation"
      ],
      "category": "api"
    },
    {
      "name": "api-testing",
      "source": "./plugins/api-testing",
      "version": "3.10.0",
      "description": "HTTP API testing for TypeScript (Supertest) and Python (httpx, pytest). Test REST APIs, GraphQL, request/response validation, authentication, and error handling.",
      "keywords": [
        "api-testing",
        "api",
        "testing",
        "rest",
        "graphql",
        "endpoints",
        "http",
        "authentication",
        "validation"
      ],
      "category": "api"
    },
    {
      "name": "api-versioning-strategy",
      "source": "./plugins/api-versioning-strategy",
      "version": "3.10.0",
      "description": "Implements API versioning using URL paths, headers, or query parameters with backward compatibility and deprecation strategies. Use when managing multiple API versions, planning breaking changes, or designing migration paths.",
      "keywords": [
        "api-versioning-strategy",
        "api",
        "versioning",
        "strategy",
        "rest",
        "graphql",
        "endpoints",
        "http",
        "url",
        "migration"
      ],
      "category": "api"
    },
    {
      "name": "app-store-deployment",
      "source": "./plugins/app-store-deployment",
      "version": "3.10.0",
      "description": "Publishes mobile applications to iOS App Store and Google Play with code signing, versioning, and CI/CD automation. Use when preparing app releases, configuring signing certificates, or setting up automated deployment pipelines.",
      "keywords": [
        "app-store-deployment",
        "app",
        "store",
        "mobile",
        "native"
      ],
      "category": "mobile"
    },
    {
      "name": "architecture-patterns",
      "source": "./plugins/architecture-patterns",